Explanatory variables,Median,MAD,95%CI,PD (%),Rhat,Bulk ESS,Tail ESS
Intercept,-10.44,3.08,"[-20.29, -6.43]",100.00,1.00,18694.88,15594.03
TY within RG? (Yes vs No),-11.16,9.61,"[-47.53, -0.69]",98.84,1.00,17592.44,13097.73
IT within RG? (Yes vs No),-0.28,1.48,"[-4.00, 2.54]",57.62,1.00,33716.08,25631.94
KR within RG? (Yes vs No),0.33,0.73,"[-1.26, 1.73]",67.37,1.00,40087.18,28167.90
TY present during focal? (Yes vs No),0.49,1.25,"[-2.06, 3.11]",65.47,1.00,22447.16,22315.23
IT present during focal? (Yes vs No),0.99,0.91,"[-0.84, 2.98]",86.45,1.00,25240.66,20587.01
No. of females within RG,-10.93,7.84,"[-38.18, -1.80]",99.92,1.00,22590.30,14843.22
No. of females on the day,-0.61,0.34,"[-1.32, 0.09]",95.77,1.00,30871.97,24204.06
No. of estrous females on the day,0.05,0.52,"[-1.01, 1.18]",53.69,1.00,24731.53,22402.61
